{
  "schema_version": 2,
  "model": "gpt-6.1-sol",
  "run_date": "2026-10-21",
  "skills_version": "b9de775f58667106f8efbcee33aa2613abea93b0",
  "runner": "Codex observation run; independent proposed assessments retained separately; human verdicts pending",
  "input_mode": "task-only",
  "status": "observed",
  "results": {},
  "provenance": {
    "au-dssp-mixed-plan-parcels": {
      "input_sha256": "d4f4afb1a7f8d9c78a94455920c827c19d7aeee3a4d4426bfa26fbc3ce7f88f8",
      "context_sha256": "4e25c773b3efc80b18ec172715c6cbd1228c1cd9c88a564936f034b684fd28e9",
      "rubric_sha256": "e745ff51eb524a53bdfc1b1079d31943f72626e8ee860f89992d9739895f8b09",
      "output_sha256": "f60a9064fcb1b38ceb8436d6f0e930d60dff5cc402ae6d6af9bdb7d04c711b00"
    },
    "au-dssp-supported-parcel-bridge": {
      "input_sha256": "4017c9579f9ac0186e8d55193981740dba394b09ac27bb6db086f3b73f7ac8b3",
      "context_sha256": "ef258f86b36ab58ebf8f9995248aa403b3c0aeafa54aceafa48bcb3f0dc6d4bb",
      "rubric_sha256": "dc507939197e98ea937922a22d1f61c7629ea86b70334a326c7608e694bd200c",
      "output_sha256": "5c85488130fd8a2f2077b31dc397d34be4660ad7225573aad105365815f7b8ab"
    },
    "au-employee-share-schemes-taxing-point": {
      "input_sha256": "a07e07318696c48ac46ca8d614540476b26f6795bf512cb6bd9185553f4bb82c",
      "context_sha256": "2e8454f42b110cb46b2d9216e20c0799601691f7747d90d82b2d4c73db799d76",
      "rubric_sha256": "0d9f5e6db3fee6d2227ec04c254ce8b468796948675391589f740e52da86e961",
      "output_sha256": "4407b1cb038f14052b65b526dfeb834426b737750693788fe93fedd342db00fb"
    },
    "au-foreign-pensions-gross-upp-and-arrears": {
      "input_sha256": "1f30698c3c084237a3a6d8a0398b965b13cbba3ce774b9f402e7ecce0f4269d9",
      "context_sha256": "930d7d42b9327ed55b27d67d05a2e0219d1ed52bda6581092876cce2531924c2",
      "rubric_sha256": "b06ee8c47cdc590d083fecfb9f04f135b155d6694738ddb11acddffc29023ef0",
      "output_sha256": "33e32bef0e60da8428ae9534245a4327bc335007e8572aba775343fbb4195c98"
    },
    "au-lump-sum-arrears-multiple-payers": {
      "input_sha256": "2f48a71ec466d553a2d0f9c6cb59da05bdf63927ae1500cab2a702013b9e034c",
      "context_sha256": "59396b1c240125429add98a6152d32ff6afd121c2c3a22ff4a5367ef7efde6c0",
      "rubric_sha256": "f0d358a4abd8f51782cc1a5c72f8cede102f0624891ade77faadf3d20d450fc4",
      "output_sha256": "946696c76912778e7347fc08ac29e7e8e9a52a96fbd84b22168fc98f059524cb"
    },
    "au-managed-fund-amit-complete-reinvestment": {
      "input_sha256": "7e3b83fad8a48a019609ddc0858983914a2f670ca7f449017e5db98a8db330e6",
      "context_sha256": "477a5f087a0a5494eb53137189fcbfe3b2114308e253b6e871d11cc910fb221b",
      "rubric_sha256": "23dd79a06219a8c74294ae62239a4d56367842bce949c5dafa988b79020ca445",
      "output_sha256": "42d70416e37118f502031b3aaaa589d14eca5a6c63dc3a5065395508e6890313"
    },
    "au-managed-fund-amit-statement-and-basis": {
      "input_sha256": "c5c3e76d2d4db3c0aba9ed4f1e8cd32fd564e852bca3542ed7424289efc67cec",
      "context_sha256": "6a8ce162b684bbe0a24238b9d7f69d31b3e6eef54243a57c9a2f927be225d68d",
      "rubric_sha256": "62c0a4fca3be77c8a04064e57d00681a74467610bac665cefbc94c1915193527",
      "output_sha256": "ca43e5d1586942c4a511152daa86c48f66f3958a6f3c87c1a073492f5f2c822a"
    },
    "au-non-commercial-losses-activity-roll-forward": {
      "input_sha256": "ab16b1567e53889aa34bb84687ff42c9da9b9349448941881677fad87b5b2bde",
      "context_sha256": "0ab6c4a4ce35e84ea5f20c086b9625f383cd71eef46141962d57499fba8ee23a",
      "rubric_sha256": "a4f854c9e9f41adadbbdb7b8bad330c9087df12235329267cf6b813f40e038e3",
      "output_sha256": "8c515ade03e50626d5f86dadd16ad667aa1c553f36563e78d2372c2d6c6e17a0"
    },
    "au-psi-review-individuals-and-test-order": {
      "input_sha256": "41f2c88498d93d1fba01023360152cc62e9b8b69762485c4e65d1202ee474c79",
      "context_sha256": "e94291dcdc28137fcfe09b6f0fc52710b7fae079a679e24e5252848af9325b5b",
      "rubric_sha256": "40374789398acd0e2ab5576425f42287f193db4c26df9daad754702beaee063f",
      "output_sha256": "16fe9a55368dd1e4a9c61f4096969095de026c0119bc7b7a622acd0bfdd522cd"
    },
    "au-sapto-complete-asymmetric-bridge": {
      "input_sha256": "04c6948e16e448bbd2da87deefb09f75de6c6e1dcb8500b37bae20275aae5d25",
      "context_sha256": "6a72db4d160f091932c22336de98118aaece3f6d06c9e543a4cfdc68ea86d24b",
      "rubric_sha256": "51ce6d4fb4d244899157aa242ed8799b0cd2239a1d6b2b3c5ee5b9f09f6f1a77",
      "output_sha256": "196f60b505b0b9a3295d463497502115b5fe6f78cc8b83cc6163e52e0cf3d383"
    },
    "au-sapto-rebate-income-and-spouse": {
      "input_sha256": "cebf1d3b55aa6967a92f8799347571c5eeb8ddf70f00c2bc6b32f04f8cdc2930",
      "context_sha256": "a3b8afaaa74dddbb5bfb1062cdd3cbdbcbb72a9fdae34b48d535facdd2a582c1",
      "rubric_sha256": "c99ccdb0e2dbce594f2c4718c8b2ab623e1eaed8d050c7908dac93f3359cdf61",
      "output_sha256": "e9c0a2dbfeba348d771a1fa019e86b4d58a8fe3006c7920c1575f23ac8ac6b59"
    },
    "au-small-business-income-offset-psi-and-losses": {
      "input_sha256": "3848751a32835079bcb05bade154ac4320ed7e428ee4df724d2deaa2be81cc28",
      "context_sha256": "526e16c447d678bf9656797bafce1318b402551ef696cbd66d4bc922cc4cefcc",
      "rubric_sha256": "e9cd2a2491e6071c7755d95507f6f484cb5026279cf1f3167060c40b0a60c90b",
      "output_sha256": "4b556963bbd50a3873282a204ef615bd1f377f21a57ded931820644ee0238c5f"
    }
  }
}
